{
  "company": "宁夏宝丰能源集团股份有限公司",
  "period": "2026H1",
  "core_view": "财报质量强：量增、价差扩张与低成本优势共同推动利润和现金流；需求侧仍弱，当前盈利包含外部供给冲击红利。",
  "expectation_gap": "正式中报相对7月预告没有明显Headline Surprise；真正的Forward Surprise是年度盈利预测在披露后继续上修，但股价相对沪深300的领先幅度更大，市场已计入较多利好。",
  "final_view": "基本面改善，股票赔率中性偏多，置信度中等。未来判断取决于油煤价差、内蒙古成本兑现、宁东四期进度和预测修订方向。",
  "confidence": {
    "level": "medium",
    "score": 0.72,
    "reason": "财报与市场数据完整；半年度专业一致预期和会后Q&A尚缺。"
  }
}